{
  "artifact_digest": "sha256:4cf7c5e4472e227388bb9fed5b87781bc1b8d0833dc699edce96f3116bee28ec",
  "files": {
    "build-metadata.json": {
      "path": "build-metadata.json",
      "sha256": "2b1a3c52f2b263b798a1e14d6d06512b0b6f5b5ebd0d1a7016a416bf132da51e"
    },
    "container-sbom.cdx.json": {
      "path": "container-sbom.cdx.json",
      "sha256": "e94b93e4a7bf40bb76366518361372c01de6fa0520d3c8a79dbb6625bb47ea8f"
    },
    "container-scan-summary.json": {
      "path": "container-scan-summary.json",
      "sha256": "5422b3d0bd3e22d6c6a9880e67db27e80e480878af3c78757011cffc15125cc2"
    },
    "image-metadata.json": {
      "path": "image-metadata.json",
      "sha256": "28214053401ba94f2bb726d5a09495a3bfa9b76197e34bb582e0ae2c1fe4751c"
    },
    "provenance.json": {
      "path": "provenance.json",
      "sha256": "52f6167486c225a26d2ca081d6721079c7223374a0b5573ed250c9ba9d50637b"
    },
    "publication-eligibility.json": {
      "path": "publication-eligibility.json",
      "sha256": "14425bba9f591980c5e0ccc65eeee02350fa2577681f30f4c18cb4103d69b844"
    },
    "release-artifact.json": {
      "path": "release-artifact.json",
      "sha256": "fe158fc5eb8dc2229e6fdf353802bcc67452133fbbe7e224e9149abb5ba3b092"
    },
    "sbom-summary.json": {
      "path": "sbom-summary.json",
      "sha256": "a956429b103b0a9d613fdefd6f7677e993cb8fca6b6616e1d0656d502dac4878"
    }
  },
  "publication_decision": "blocked",
  "schema_version": "1.0",
  "source_commit": "7bc2106054f197fdd432ce11412aede926764812"
}
